{
  "apiVersion": "hybridtm.io/kb/v1",
  "kind": "RiskPattern",
  "metadata": {
    "id": "RP-INTERNET-FACING-PROXY",
    "version": "1.0.0"
  },
  "spec": {
    "title": "Internet-facing perimeter component",
    "applies_when": "component.props.bool('internet_facing')",
    "threats": [
      "THREAT-DDOS-VOLUMETRIC",
      "THREAT-TLS-DOWNGRADE",
      "THREAT-HTTP-REQUEST-SMUGGLING",
      "THREAT-INFORMATION-DISCLOSURE-HEADERS"
    ]
  }
}
